{
  "type": "docs",
  "version": "1.0",
  "entries": [
    {
      "title": "Workspace Rule Implementation",
      "summary": "Implementation patterns for workspace-level AI behavior rules, portable across Amazon Q, Cursor, Copilot, and other AI systems.",
      "path": "rules/workspace-implementation.md",
      "commit_hash": "acacba9e555a1d1dc832a572775a717ad18127a5",
      "last_updated": "2026-07-15",
      "status": "active",
      "read_when": [
        "Implementing workspace rules in new projects",
        "Setting up AI behavior enforcement systems",
        "Adapting rule patterns to different workspaces or AI systems",
        "Understanding rule implementation architecture"
      ]
    },
    {
      "title": "Rule Creation Best Practices",
      "summary": "Software engineering principles and patterns for creating maintainable workspace rules.",
      "path": "rules/best-practices.md",
      "commit_hash": "acacba9e555a1d1dc832a572775a717ad18127a5",
      "last_updated": "2025-01-16",
      "status": "active",
      "read_when": [
        "Creating new workspace rules",
        "Refactoring existing rule architecture",
        "Designing rule systems for AI behavior enforcement",
        "Applying software engineering principles to rule design"
      ]
    },
    {
      "title": "Rules",
      "summary": "Best practices for creating and managing workspace rules for AI behavior enforcement.",
      "path": "rules/definition.md",
      "commit_hash": "acacba9e555a1d1dc832a572775a717ad18127a5",
      "last_updated": "2025-01-16",
      "status": "active",
      "read_when": [
        "Creating new workspace rules for AI behavior",
        "Designing rule architecture and organization",
        "Maintaining existing rule sets",
        "Understanding rule vs prompt differences"
      ]
    },
    {
      "title": "Documentation Hub",
      "summary": "Multi-source documentation registry hub with Git repositories, CI pipelines, and index.json for on-demand knowledge loading.",
      "path": "docs/hub.md",
      "commit_hash": "acacba9e555a1d1dc832a572775a717ad18127a5",
      "last_updated": "2025-01-16",
      "status": "active",
      "read_when": [
        "Designing the doc hub system or index.json contract",
        "Evaluating whether a doc hub is useful for a specific domain or team",
        "Comparing doc hub design to skill hub design"
      ]
    },
    {
      "title": "Specification Organization",
      "summary": "Organizational principles for agent foundation specifications including domain grouping, naming conventions, and cross-reference standards.",
      "path": "docs/organization.md",
      "commit_hash": "acacba9e555a1d1dc832a572775a717ad18127a5",
      "last_updated": "2025-01-16",
      "status": "active",
      "read_when": [
        "Deciding where to place a new specification document",
        "Establishing naming conventions for specification files",
        "Setting up cross-reference standards between specifications"
      ]
    },
    {
      "title": "Documentation Authoring",
      "summary": "How to author documentation files with machine-readable YAML frontmatter for Agent Zero.",
      "path": "docs/authoring-guide.md",
      "commit_hash": "acacba9e555a1d1dc832a572775a717ad18127a5",
      "last_updated": "2025-01-16",
      "status": "active",
      "read_when": [
        "Writing or reviewing a documentation file",
        "Adding frontmatter to an existing doc",
        "Designing the doc discovery or context-loading system",
        "Understanding cross-reference fields between artifact types"
      ]
    },
    {
      "title": "What are Documents?",
      "summary": "Documents are markdown files with machine-readable frontmatter that provide knowledge to agents on demand.",
      "path": "docs/definition.md",
      "commit_hash": "acacba9e555a1d1dc832a572775a717ad18127a5",
      "last_updated": "2025-01-16",
      "status": "active",
      "read_when": [
        "Understanding what documents are and how they work",
        "Learning about the document format and structure",
        "Implementing document support in an agent system"
      ]
    },
    {
      "title": "Hub Configuration",
      "summary": "Unified configuration format for managing both skill and documentation hub sources in agent systems",
      "path": "docs/hub-configuration.md",
      "commit_hash": "acacba9e555a1d1dc832a572775a717ad18127a5",
      "last_updated": "2025-01-16",
      "status": "active",
      "read_when": [
        "Implementing hub source management in agent systems",
        "Designing agent configuration files",
        "Understanding hub discovery and caching mechanisms",
        "Configuring multiple skill and doc hubs"
      ]
    },
    {
      "title": "Taint Supervisor Pattern",
      "summary": "Centralized architecture for managing taint assignment, policy enforcement, and audit logging in information flow tracking systems",
      "path": "information-flow/taint-supervisor.md",
      "commit_hash": "acacba9e555a1d1dc832a572775a717ad18127a5",
      "last_updated": "2025-01-16",
      "status": "active",
      "read_when": [
        "Designing centralized taint management for agent systems",
        "Implementing audit trails for information flow tracking",
        "Refactoring scattered taint assignment into a unified system",
        "Building policy management for data flow controls"
      ]
    },
    {
      "title": "Taint Audit Log Events",
      "summary": "Event schema for taint tracking audit logs - structured records of taint operations for compliance and analysis",
      "path": "information-flow/audit-events.md",
      "commit_hash": "acacba9e555a1d1dc832a572775a717ad18127a5",
      "last_updated": "2025-01-16",
      "status": "active",
      "read_when": [
        "Implementing taint supervisor audit logging",
        "Building audit log analysis tools",
        "Designing compliance and monitoring systems",
        "Understanding taint tracking observability"
      ]
    },
    {
      "title": "Information Flow Tracking",
      "summary": "Track data origin and sensitivity through agent systems using taint labels to prevent information leakage and enforce security policies",
      "path": "information-flow/definition.md",
      "commit_hash": "acacba9e555a1d1dc832a572775a717ad18127a5",
      "last_updated": "2025-01-16",
      "status": "active",
      "read_when": [
        "Designing security controls for agent systems handling mixed-sensitivity data",
        "Implementing data flow tracking and taint analysis",
        "Preventing information leakage in multi-agent systems",
        "Understanding information flow security patterns"
      ]
    },
    {
      "title": "Taint Specification Language (TSL) Core",
      "summary": "Declarative YAML format for specifying taint policies - sources, sinks, and basic propagation rules",
      "path": "information-flow/tsl-core.md",
      "commit_hash": "acacba9e555a1d1dc832a572775a717ad18127a5",
      "last_updated": "2025-01-16",
      "status": "active",
      "read_when": [
        "Defining taint policies declaratively for agent systems",
        "Creating portable taint specifications across implementations",
        "Implementing policy-as-code for information flow tracking"
      ]
    },
    {
      "title": "Agent Manifest Specification",
      "summary": "Authoritative specification for agent manifests - the declarative format for agent identity, capabilities, runtime configuration, and security policies",
      "path": "agents/agent-manifest-specification.md",
      "commit_hash": "acacba9e555a1d1dc832a572775a717ad18127a5",
      "last_updated": "2025-01-16",
      "status": "active",
      "read_when": [
        "Designing agent systems that require capability-based security",
        "Planning agent identity and authorization mechanisms",
        "Architecting agent registries and management systems",
        "Creating agent manifest authoring and validation tools"
      ]
    },
    {
      "title": "Agent Definition",
      "summary": "Foundational definition of agents - autonomous software entities with identity, capabilities, and security boundaries that operate within agent systems",
      "path": "agents/definition.md",
      "commit_hash": "acacba9e555a1d1dc832a572775a717ad18127a5",
      "last_updated": "2025-01-16",
      "status": "active",
      "read_when": [
        "Understanding the fundamental concept of agents in agent systems",
        "Designing agent architectures and interaction patterns",
        "Planning agent security and capability models",
        "Establishing agent system terminology and concepts"
      ]
    },
    {
      "title": "Agent Manifest Registry Specification",
      "summary": "Registry system for storing, versioning, and managing signed agent manifests with support for hot reload, revocation, and lifecycle operations",
      "path": "agents/agent-manifest-registry.md",
      "commit_hash": "acacba9e555a1d1dc832a572775a717ad18127a5",
      "last_updated": "2025-01-16",
      "status": "active",
      "read_when": [
        "Designing agent manifest storage and versioning systems",
        "Building agent registry services and management APIs",
        "Planning manifest distribution and synchronization mechanisms",
        "Creating manifest lifecycle management tools"
      ]
    },
    {
      "title": "Skill Hub",
      "summary": "Multi-source skill registry hub with Git repositories, CI pipelines, and index.json for skill distribution and management.",
      "path": "skills/hub.md",
      "commit_hash": "acacba9e555a1d1dc832a572775a717ad18127a5",
      "last_updated": "2025-01-16",
      "status": "active",
      "read_when": [
        "Designing the hub system, the index.json contract, CI pipeline for a hub repo",
        "Setting up multi-hub configuration model",
        "Comparing skill hub design to doc hub design"
      ]
    },
    {